{
  "ticker": "010120:KRX",
  "timeframe": "1d",
  "window": "2Y",
  "schemaVersion": 1,
  "intervalSeconds": 86400,
  "source": "gf",
  "resolvedSymbol": "KRX:010120",
  "fetchedAt": "2026-10-27T07:08:02.632Z",
  "lastBarDate": "2026-10-26",
  "barCount": 953,
  "checksum": "3c42ebbd",
  "ohlcv": [
    {
      "date": "2022-11-21",
      "open": 11260,
      "high": 11460,
      "low": 11100,
      "close": 11200,
      "volume": 142269
    },
    {
      "date": "2022-11-22",
      "open": 11320,
      "high": 11800,
      "low": 11140,
      "close": 11780,
      "volume": 217573
    },
    {
      "date": "2022-11-23",
      "open": 11740,
      "high": 11900,
      "low": 11560,
      "close": 11780,
      "volume": 106796
    },
    {
      "date": "2022-11-24",
      "open": 11780,
      "high": 12080,
      "low": 11620,
      "close": 11920,
      "volume": 137877
    },
    {
      "date": "2022-11-25",
      "open": 12000,
      "high": 12180,
      "low": 11820,
      "close": 12000,
      "volume": 93983
    },
    {
      "date": "2022-11-28",
      "open": 12060,
      "high": 12240,
      "low": 11820,
      "close": 11960,
      "volume": 98211
    },
    {
      "date": "2022-11-29",
      "open": 12000,
      "high": 12060,
      "low": 11600,
      "close": 11640,
      "volume": 120203
    },
    {
      "date": "2022-11-30",
      "open": 11660,
      "high": 11840,
      "low": 11500,
      "close": 11540,
      "volume": 107112
    },
    {
      "date": "2022-12-01",
      "open": 11660,
      "high": 11660,
      "low": 11260,
      "close": 11320,
      "volume": 152030
    },
    {
      "date": "2022-12-02",
      "open": 11260,
      "high": 11320,
      "low": 10900,
      "close": 11100,
      "volume": 129662
    },
    {
      "date": "2022-12-05",
      "open": 11140,
      "high": 11180,
      "low": 10860,
      "close": 10980,
      "volume": 88025
    },
    {
      "date": "2022-12-06",
      "open": 10920,
      "high": 11020,
      "low": 10680,
      "close": 10680,
      "volume": 105469
    },
    {
      "date": "2022-12-07",
      "open": 10680,
      "high": 10880,
      "low": 10500,
      "close": 10740,
      "volume": 111625
    },
    {
      "date": "2022-12-08",
      "open": 10640,
      "high": 11020,
      "low": 10640,
      "close": 10820,
      "volume": 95940
    },
    {
      "date": "2022-12-09",
      "open": 11120,
      "high": 11120,
      "low": 10860,
      "close": 11020,
      "volume": 132011
    },
    {
      "date": "2022-12-12",
      "open": 11020,
      "high": 11420,
      "low": 10860,
      "close": 11300,
      "volume": 134462
    },
    {
      "date": "2022-12-13",
      "open": 11440,
      "high": 11480,
      "low": 11040,
      "close": 11080,
      "volume": 81997
    },
    {
      "date": "2022-12-14",
      "open": 11220,
      "high": 11360,
      "low": 11080,
      "close": 11300,
      "volume": 94151
    },
    {
      "date": "2022-12-15",
      "open": 11220,
      "high": 11540,
      "low": 11180,
      "close": 11360,
      "volume": 74984
    },
    {
      "date": "2022-12-16",
      "open": 11240,
      "high": 11600,
      "low": 11220,
      "close": 11300,
      "volume": 109510
    },
    {
      "date": "2022-12-19",
      "open": 11240,
      "high": 11500,
      "low": 11060,
      "close": 11420,
      "volume": 57510
    },
    {
      "date": "2022-12-20",
      "open": 11360,
      "high": 11780,
      "low": 11340,
      "close": 11520,
      "volume": 139602
    },
    {
      "date": "2022-12-21",
      "open": 11660,
      "high": 11880,
      "low": 11480,
      "close": 11720,
      "volume": 122112
    },
    {
      "date": "2022-12-22",
      "open": 11760,
      "high": 11880,
      "low": 11520,
      "close": 11780,
      "volume": 100519
    },
    {
      "date": "2022-12-23",
      "open": 11760,
      "high": 11820,
      "low": 11620,
      "close": 11700,
      "volume": 94491
    },
    {
      "date": "2022-12-26",
      "open": 11640,
      "high": 11760,
      "low": 11560,
      "close": 11600,
      "volume": 70261
    },
    {
      "date": "2022-12-27",
      "open": 11640,
      "high": 11680,
      "low": 11280,
      "close": 11500,
      "volume": 102656
    },
    {
      "date": "2022-12-28",
      "open": 11280,
      "high": 11760,
      "low": 11220,
      "close": 11580,
      "volume": 109669
    },
    {
      "date": "2022-12-29",
      "open": 11480,
      "high": 11620,
      "low": 11180,
      "close": 11280,
      "volume": 123010
    },
    {
      "date": "2023-01-02",
      "open": 11360,
      "high": 11380,
      "low": 10860,
      "close": 11020,
      "volume": 66132
    },
    {
      "date": "2023-01-03",
      "open": 11020,
      "high": 11040,
      "low": 10400,
      "close": 10480,
      "volume": 140385
    },
    {
      "date": "2023-01-04",
      "open": 10420,
      "high": 10420,
      "low": 10060,
      "close": 10320,
      "volume": 97120
    },
    {
      "date": "2023-01-05",
      "open": 10300,
      "high": 10340,
      "low": 9720,
      "close": 9900,
      "volume": 306992
    },
    {
      "date": "2023-01-06",
      "open": 9880,
      "high": 10000,
      "low": 9780,
      "close": 9900,
      "volume": 111687
    },
    {
      "date": "2023-01-09",
      "open": 10040,
      "high": 10140,
      "low": 9950,
      "close": 10060,
      "volume": 86747
    },
    {
      "date": "2023-01-10",
      "open": 10080,
      "high": 10400,
      "low": 10080,
      "close": 10280,
      "volume": 99437
    },
    {
      "date": "2023-01-11",
      "open": 10400,
      "high": 10400,
      "low": 10220,
      "close": 10300,
      "volume": 68886
    },
    {
      "date": "2023-01-12",
      "open": 10360,
      "high": 10800,
      "low": 10360,
      "close": 10680,
      "volume": 126178
    },
    {
      "date": "2023-01-13",
      "open": 10760,
      "high": 10840,
      "low": 10520,
      "close": 10560,
      "volume": 69121
    },
    {
      "date": "2023-01-16",
      "open": 10640,
      "high": 10800,
      "low": 10440,
      "close": 10620,
      "volume": 79662
    },
    {
      "date": "2023-01-17",
      "open": 10580,
      "high": 10700,
      "low": 10500,
      "close": 10620,
      "volume": 56671
    },
    {
      "date": "2023-01-18",
      "open": 10660,
      "high": 10680,
      "low": 10160,
      "close": 10200,
      "volume": 217826
    },
    {
      "date": "2023-01-19",
      "open": 10160,
      "high": 10320,
      "low": 10140,
      "close": 10240,
      "volume": 74390
    },
    {
      "date": "2023-01-25",
      "open": 10360,
      "high": 10400,
      "low": 10140,
      "close": 10360,
      "volume": 100472
    },
    {
      "date": "2023-01-26",
      "open": 10320,
      "high": 10460,
      "low": 10220,
      "close": 10400,
      "volume": 75680
    },
    {
      "date": "2023-01-27",
      "open": 10440,
      "high": 10640,
      "low": 10340,
      "close": 10500,
      "volume": 84863
    },
    {
      "date": "2023-01-30",
      "open": 10500,
      "high": 10580,
      "low": 10380,
      "close": 10440,
      "volume": 65680
    },
    {
      "date": "2023-01-31",
      "open": 10500,
      "high": 10680,
      "low": 10360,
      "close": 10660,
      "volume": 85389
    },
    {
      "date": "2023-02-01",
      "open": 10460,
      "high": 10480,
      "low": 9620,
      "close": 9680,
      "volume": 1016751
    },
    {
      "date": "2023-02-02",
      "open": 9780,
      "high": 9830,
      "low": 9700,
      "close": 9800,
      "volume": 321556
    },
    {
      "date": "2023-02-03",
      "open": 9820,
      "high": 9910,
      "low": 9780,
      "close": 9880,
      "volume": 217212
    },
    {
      "date": "2023-02-06",
      "open": 9820,
      "high": 9890,
      "low": 9740,
      "close": 9780,
      "volume": 110702
    },
    {
      "date": "2023-02-07",
      "open": 9790,
      "high": 9840,
      "low": 9550,
      "close": 9620,
      "volume": 308315
    },
    {
      "date": "2023-02-08",
      "open": 9670,
      "high": 10040,
      "low": 9610,
      "close": 10020,
      "volume": 373480
    },
    {
      "date": "2023-02-09",
      "open": 9920,
      "high": 10020,
      "low": 9860,
      "close": 9870,
      "volume": 194242
    },
    {
      "date": "2023-02-10",
      "open": 9820,
      "high": 9850,
      "low": 9630,
      "close": 9830,
      "volume": 152255
    },
    {
      "date": "2023-02-13",
      "open": 9810,
      "high": 9920,
      "low": 9740,
      "close": 9900,
      "volume": 98597
    },
    {
      "date": "2023-02-14",
      "open": 9940,
      "high": 10000,
      "low": 9830,
      "close": 9960,
      "volume": 120931
    },
    {
      "date": "2023-02-15",
      "open": 9960,
      "high": 9970,
      "low": 9790,
      "close": 9840,
      "volume": 120617
    },
    {
      "date": "2023-02-16",
      "open": 9900,
      "high": 9990,
      "low": 9870,
      "close": 9960,
      "volume": 92674
    },
    {
      "date": "2023-02-17",
      "open": 9880,
      "high": 10080,
      "low": 9820,
      "close": 10020,
      "volume": 129228
    },
    {
      "date": "2023-02-20",
      "open": 9980,
      "high": 10040,
      "low": 9840,
      "close": 9980,
      "volume": 68576
    },
    {
      "date": "2023-02-21",
      "open": 9970,
      "high": 10040,
      "low": 9880,
      "close": 9980,
      "volume": 117638
    },
    {
      "date": "2023-02-22",
      "open": 9910,
      "high": 10140,
      "low": 9860,
      "close": 10080,
      "volume": 145474
    },
    {
      "date": "2023-02-23",
      "open": 10120,
      "high": 10280,
      "low": 10040,
      "close": 10220,
      "volume": 145809
    },
    {
      "date": "2023-02-24",
      "open": 10320,
      "high": 10420,
      "low": 10060,
      "close": 10100,
      "volume": 111466
    },
    {